{
  "schema": "canvas-ir/1",
  "canvas": {"w": 960, "h": 540, "unit": "pt"},
  "target": {
    "template": "reference/renderer_template.pptx",
    "template_sha256": "60fe35466ed2bb477d592603d0eab9d8748521e54ae0632c9f6a94d0b02a855a",
    "layout_index": 3
  },
  "title": "Reserved-region edges — every one of these MUST pass",
  "elements": [
    {
      "id": "top_flush_at_92",
      "type": "rect",
      "x": 45.6,
      "y": 92,
      "w": 300,
      "h": 60,
      "fill": "#FF0032",
      "text": {
        "align": "CENTER",
        "valign": "MIDDLE",
        "paragraphs": [
          {"runs": [{"t": "y == 92: touches HEADER, does not intersect it", "size": 11, "color": "#FFFFFF"}]}
        ]
      }
    },
    {
      "id": "bottom_flush_at_500_over_footer_x",
      "type": "rect",
      "x": 800,
      "y": 440,
      "w": 100,
      "h": 60,
      "fill": "#FFFFFF",
      "stroke": {"color": "#000000", "width": 1},
      "text": {
        "align": "CENTER",
        "valign": "MIDDLE",
        "paragraphs": [
          {"runs": [{"t": "y2 == 500", "size": 10, "color": "#000000"}]}
        ]
      }
    },
    {
      "id": "full_bleed_band_outside_body_safe",
      "type": "rect",
      "x": 0,
      "y": 200,
      "w": 960,
      "h": 40,
      "fill": "#FF0032",
      "text": {
        "align": "CENTER",
        "valign": "MIDDLE",
        "paragraphs": [
          {"runs": [{"t": "full-bleed x 0..960 — outside BODY_SAFE, but BODY_SAFE is not a rejection region", "size": 11, "color": "#FFFFFF"}]}
        ]
      }
    },
    {
      "id": "connector_flush_at_500",
      "type": "connector",
      "kind": "straight",
      "x1": 740,
      "y1": 500,
      "x2": 950,
      "y2": 500,
      "color": "#000000",
      "width": 1,
      "arrow": "none"
    }
  ]
}
