{
  "schema": "canvas-ir/1",
  "canvas": {"w": 960, "h": 540, "unit": "pt"},
  "target": {
    "template": "reference/renderer_template.pptx",
    "template_sha256": "60fe35466ed2bb477d592603d0eab9d8748521e54ae0632c9f6a94d0b02a855a",
    "layout_index": 3
  },
  "title": "Every connector kind x arrow",
  "elements": [
    {
      "id": "straight_none",
      "type": "connector",
      "kind": "straight",
      "x1": 60,
      "y1": 120,
      "x2": 300,
      "y2": 120,
      "color": "#000000",
      "width": 1,
      "arrow": "none"
    },
    {
      "id": "straight_start",
      "type": "connector",
      "kind": "straight",
      "x1": 60,
      "y1": 200,
      "x2": 300,
      "y2": 200,
      "color": "#FF0032",
      "width": 1,
      "arrow": "start"
    },
    {
      "id": "straight_end",
      "type": "connector",
      "kind": "straight",
      "x1": 60,
      "y1": 280,
      "x2": 300,
      "y2": 280,
      "color": "#FF0032",
      "width": 2,
      "arrow": "end"
    },
    {
      "id": "straight_both",
      "type": "connector",
      "kind": "straight",
      "x1": 60,
      "y1": 360,
      "x2": 300,
      "y2": 360,
      "color": "#FF0032",
      "width": 2,
      "arrow": "both"
    },
    {
      "id": "elbow_none",
      "type": "connector",
      "kind": "elbow",
      "x1": 560,
      "y1": 120,
      "x2": 800,
      "y2": 160,
      "color": "#000000",
      "width": 1,
      "arrow": "none"
    },
    {
      "id": "elbow_start",
      "type": "connector",
      "kind": "elbow",
      "x1": 560,
      "y1": 200,
      "x2": 800,
      "y2": 240,
      "color": "#FF0032",
      "width": 1,
      "arrow": "start"
    },
    {
      "id": "elbow_end",
      "type": "connector",
      "kind": "elbow",
      "x1": 560,
      "y1": 280,
      "x2": 800,
      "y2": 320,
      "color": "#FF0032",
      "width": 2,
      "arrow": "end"
    },
    {
      "id": "elbow_both",
      "type": "connector",
      "kind": "elbow",
      "x1": 560,
      "y1": 360,
      "x2": 800,
      "y2": 400,
      "color": "#FF0032",
      "width": 2,
      "arrow": "both"
    }
  ]
}
