{
  "schema": "canvas-ir/1",
  "canvas": {"w": 960, "h": 540, "unit": "pt"},
  "target": {
    "template": "reference/renderer_template.pptx",
    "template_sha256": "60fe35466ed2bb477d592603d0eab9d8748521e54ae0632c9f6a94d0b02a855a",
    "layout_index": 3
  },
  "title": "Every shape type",
  "elements": [
    {
      "id": "rect_plain",
      "type": "rect",
      "x": 45.6,
      "y": 120,
      "w": 200,
      "h": 120,
      "fill": "#FF0032",
      "stroke": null,
      "text": {
        "align": "CENTER",
        "valign": "MIDDLE",
        "paragraphs": [{"runs": [{"t": "rect", "size": 14, "color": "#FFFFFF"}]}]
      }
    },
    {
      "id": "ellipse_stroked",
      "type": "ellipse",
      "x": 265.6,
      "y": 120,
      "w": 200,
      "h": 120,
      "fill": "#FFFFFF",
      "stroke": {"color": "#000000", "width": 1},
      "text": {
        "align": "CENTER",
        "valign": "MIDDLE",
        "paragraphs": [{"runs": [{"t": "ellipse", "size": 14, "color": "#000000"}]}]
      }
    },
    {
      "id": "triangle_thick",
      "type": "triangle",
      "x": 485.6,
      "y": 120,
      "w": 200,
      "h": 120,
      "fill": "#FF0032",
      "stroke": {"color": "#000000", "width": 4}
    },
    {
      "id": "textbox_nofill",
      "type": "textbox",
      "x": 705.6,
      "y": 120,
      "w": 200,
      "h": 120,
      "fill": null,
      "stroke": null,
      "text": {
        "align": "LEFT",
        "valign": "TOP",
        "paragraphs": [{"runs": [{"t": "textbox", "size": 14, "color": "#000000"}]}]
      }
    },
    {
      "id": "rect_hairline",
      "type": "rect",
      "x": 45.6,
      "y": 280,
      "w": 200,
      "h": 100,
      "fill": "#FFFFFF",
      "stroke": {"color": "#000000", "width": 0},
      "text": {
        "align": "CENTER",
        "valign": "MIDDLE",
        "paragraphs": [
          {"runs": [{"t": "stroke width 0 = HAIRLINE, not 'no line'", "size": 11, "color": "#000000"}]}
        ]
      }
    },
    {
      "id": "rect_nofill",
      "type": "rect",
      "x": 265.6,
      "y": 280,
      "w": 200,
      "h": 100,
      "fill": null,
      "stroke": {"color": "#FF0032", "width": 2},
      "text": {
        "align": "CENTER",
        "valign": "MIDDLE",
        "paragraphs": [
          {"runs": [{"t": "fill: null = <a:noFill/>", "size": 11, "color": "#000000"}]}
        ]
      }
    }
  ]
}
