{
  "schema": "canvas-ir/1",
  "canvas": {"w": 960, "h": 540, "unit": "pt"},
  "target": {
    "template": "reference/renderer_template.pptx",
    "template_sha256": "60fe35466ed2bb477d592603d0eab9d8748521e54ae0632c9f6a94d0b02a855a",
    "layout_index": 3
  },
  "title": "Rotation, about the box centre",
  "elements": [
    {
      "id": "rot_0",
      "type": "rect",
      "x": 45.6,
      "y": 120,
      "w": 120,
      "h": 80,
      "rotation": 0,
      "fill": "#FF0032",
      "text": {
        "align": "CENTER",
        "valign": "MIDDLE",
        "paragraphs": [{"runs": [{"t": "0", "size": 14, "color": "#FFFFFF"}]}]
      }
    },
    {
      "id": "rot_30",
      "type": "rect",
      "x": 245.6,
      "y": 140,
      "w": 120,
      "h": 80,
      "rotation": 30,
      "fill": "#FF0032",
      "text": {
        "align": "CENTER",
        "valign": "MIDDLE",
        "paragraphs": [{"runs": [{"t": "30", "size": 14, "color": "#FFFFFF"}]}]
      }
    },
    {
      "id": "rot_45",
      "type": "rect",
      "x": 430,
      "y": 250,
      "w": 100,
      "h": 100,
      "rotation": 45,
      "fill": "#FF0032",
      "text": {
        "align": "CENTER",
        "valign": "MIDDLE",
        "paragraphs": [{"runs": [{"t": "45", "size": 14, "color": "#FFFFFF"}]}]
      }
    },
    {
      "id": "rot_315",
      "type": "ellipse",
      "x": 700,
      "y": 200,
      "w": 120,
      "h": 80,
      "rotation": 315,
      "fill": "#FFFFFF",
      "stroke": {"color": "#000000", "width": 1},
      "text": {
        "align": "CENTER",
        "valign": "MIDDLE",
        "paragraphs": [{"runs": [{"t": "315", "size": 14, "color": "#000000"}]}]
      }
    }
  ]
}
